"Title","Price"
"Beautiful Private Villa on Pearl Qatar","48,000,000 QAR"
"Beautiful Private Villa on The Pearl Qatar","48,000,000 QAR"
"2 LUXURY BRAND NEW VILLAS IN PEARL QATAR","45,000,000 QAR"
"Luxurious Villa with Stunning Sea View","45,000,000 QAR"
"6 Bed Standalone Villa attached to the Beach","45,000,000 QAR"
"Rare Opportunity : Charming villa with beach access","45,000,000 QAR"
"STUNNING STAND ALONE VILLA FOR SALE - THE PEARL","44,000,000 QAR"
"6 Bedrooms Water Views Villa","42,000,000 QAR"
"MAJESTIC VILLA WITH ACCESS TO THE BEACH","42,000,000 QAR"
"Stunning &amp; Unique villa with private beach!","42,000,000 QAR"
"Unique Luxury 6 bedroom villa with the private beach!","42,000,000 QAR"
"Modern 4+Maid Furnished Villa","40,000,000 QAR"
"Beach front must see luxurious 4 bedroom villa on the beach!","40,000,000 QAR"
"Beautiful Private Villa in The Pearl Qatar","39,000,000 QAR"
"For Sale Duplex Villas within promising Project","9,220,000 QAR"
"Unfurnished Villa for sale at the Pearl!","7,500,000 QAR"
"ALLURING VILLA FOR SALE AT THE PEARL :)","7,500,000 QAR"
